"","ï..id","booked","host_since","host_about","host_response_time","host_response_rate","host_acceptance_rate","host_is_superhost","host_listings_count","host_total_listings_count","host_verifications","price","host_since_frm","days_since","email","social","phone","reviews"
"652",2165569,109,"30-11-2011","I am a full time composer and performer. I have lived in Asheville for five, colorful years and am proud of my neighborhood and vibrant community. I am an active cyclist, runner, yogi, swimmer and hiker. I love to dine out, shop local and gallery hop. I've traveled and toured all over the world and know the value of comfortable, affordable, peaceful, no frills accommodations.","within an hour","100%","100%","f",1,1,"['email', 'phone', 'facebook', 'reviews', 'manual_offline', 'jumio']","$ 99.00",2011-11-30,1913,1,1,1,1
"653",7418991,0,"29-10-2014","","within an hour","100%","100%","t",1,1,"['email', 'phone', 'facebook', 'reviews']","$ 117.00",2014-10-29,849,1,1,1,1
"654",80905,0,"07-03-2011","Having lived in Asheville for 19 years, sharing tips about places to dine and things to do is a natural joy. I've been designing and developing properties for more than a decade. Creating spaces for guests to enjoy is a true labor of love! I also enjoy travel, and have integrated some architectural pieces I've gathered along the journey into some of my rentals. 
I'm so delighted to accommodate you, your family, and friends!","within an hour","100%","79%","f",8,8,"['email', 'phone', 'facebook', 'linkedin', 'reviews', 'kba']","$ 315.00",2011-03-07,2181,1,1,1,1
"655",2226571,0,"29-01-2013"," I helped  Fred open Rankin House after he completed the renovations on this incredible place. I love this job along with music, photography, and another  home I'm renovating for vacation rentals. I like hanging in the background, ready to help you with what you need for a comfortable stay.","within a few hours","100%","100%","f",7,7,"['email', 'phone', 'facebook', 'google', 'reviews', 'kba']","$ 139.00",2013-01-29,1487,1,1,1,1
"656",2226812,2,"29-01-2013"," I helped  Fred open Rankin House after he completed the renovations on this incredible place. I love this job along with music, photography, and another  home I'm renovating for vacation rentals. I like hanging in the background, ready to help you with what you need for a comfortable stay.","within a few hours","100%","100%","f",7,7,"['email', 'phone', 'facebook', 'google', 'reviews', 'kba']","$ 139.00",2013-01-29,1487,1,1,1,1
"657",8531465,109,"08-08-2013","I'm originally from Chicago, went to school in Iowa, and worked on agricultural and food policy at the Environmental Protection Agency in DC for 7 years before I moved to Asheville in 2013. I love interesting food, craft beer, and music, and I love sharing all of these with good friends, both old and new. I also love to travel and meet interesting people, and I'm excited to provide a cozy resting spot for fellow travelers looking to explore the area. Hope to see you soon!","within an hour","100%","100%","t",2,2,"['email', 'phone', 'reviews', 'kba']","$ 90.00",2013-08-08,1296,1,1,1,1
"658",2215202,0,"29-01-2013"," I helped  Fred open Rankin House after he completed the renovations on this incredible place. I love this job along with music, photography, and another  home I'm renovating for vacation rentals. I like hanging in the background, ready to help you with what you need for a comfortable stay.","within a few hours","100%","100%","f",7,7,"['email', 'phone', 'facebook', 'google', 'reviews', 'kba']","$ 149.00",2013-01-29,1487,1,1,1,1
"659",6399802,0,"21-07-2013","I love to dance, hike, and meet people. I'm a green builder and real estate person, so I like helping with housing and visions for how we can get along better.","within an hour","100%","100%","f",5,5,"['email', 'phone', 'facebook', 'google', 'reviews', 'kba']","$ 69.00",2013-07-21,1314,1,1,1,1
"660",8485640,0,"31-05-2014","Hi!  I manage the admin for my dear friends, who own this beautiful house. I will be your primary point of contact, so feel free to contact me with questions. We are happy to accommodate you, whether you desire a very independent stay, or you'd like some helpful advice on where to go/what to do around Asheville. We know ALL the best dining options in town, craft cocktail/brewery spots, and best jazz clubs/musicians. We can recommend hikes in the beautiful mountains surrounding Asheville, and can send you links to great websites with all the trail data.  I'll make sure the space is clean, comfortable for your arrival. (Booking with us, in effect, directly supporting the arts, as the home owners and I include professional musicians, actors, writers and artists!)","within a few hours","88%","67%","t",2,2,"['email', 'phone', 'facebook', 'google', 'reviews', 'jumio']","$ 100.00",2014-05-31,1000,1,1,1,1
"661",7438838,109,"14-09-2014","Early 40's married couple who LOVE to travel. We've been to 25 countries and are just getting started. Ron works for an airline, and Helen works for a local  non-profit  conserving Southern forests. We love Asheville's mountains, beer, riding our motorcycles on the nearby Blue Ridge Parkway and walking downtown to bars and restaurants. We bought our 1900 farmhouse 15 years ago and have been renovating it with love ever since.","within an hour","100%","100%","f",1,1,"['email', 'phone', 'google', 'reviews', 'manual_offline', 'jumio']","$ 150.00",2014-09-14,894,1,1,1,1
"662",6415234,109,"13-08-2014","We met as friends in 2005 at Appalachian State University. Kris moved to Tokyo for many years while Dani moved to NYC after graduation. We reunited in Brooklyn several years later and soon fell in love, had a baby, and moved to a majestic city by the name of Asheville, North Carolina.  We live life with a sense of adventure. We love travel, good food, movies, art, and our baby boy Max!","N/A","N/A","N/A","f",1,1,"['email', 'phone', 'facebook', 'reviews', 'kba']","$ 100.00",2014-08-13,926,1,1,1,1
"663",2222067,109,"15-01-2014","I am a vibrant self motivated person who likes to live each day to it's fullest.  Some of my favorite things in life are traveling, mountain biking, yoga, dance, live music, cooking, reading, watching movies and making connections with people.

My hosting style to to give people as much or as little attention as they desire.  I feel it is of utmost importance to provide a clean, comfortable & safe space with some necessities and peace & quiet.  I like to share fun and interesting things to do in our great town of Asheville and point folks to current entertainment events.

My motto in life is to be as kind and compassionate to yourself and others  each day~ And just ENJOY!","within a day","75%","97%","f",2,2,"['email', 'phone', 'reviews', 'jumio']","$ 65.00",2014-01-15,1136,1,1,1,1
"664",9562953,0,"30-07-2013","A California native and resident of the U.S. Virgin Islands for over 20 years, I am a seasoned traveler and always searching for the next great ""small town"".  After buying our home in 2008 in the still sleepy Asheville, I lovingly remodeled it and had hopes to make it my full-time residence within a few years.  Unfortunately, life got in the way and I've still not been able to make it my full-time residence but enjoy frequent trips there annually.  I am currently located in California and in between there, Colorado and Asheville with frequent trips to the Dominican Republic.  I am an Interior Decorator, Kitchen and Bath remodeler and Home Stager.  I also work as an Independent Consultant on Marketing and Branding for businesses large and small, and coordinate and sell golf trips to Casa de Campo in the Dominican Republic.  I am an avid golfer, sailor, tennis-player and love horses and dancing on the side.  I love cooking and entertaining for friends (my house is PERFECT for dinner parties) and love trying out new foods from different cultures all the time.  I love to speak other languages such as Japanese, French and Spanish.","within a few hours","70%","60%","f",1,1,"['email', 'phone', 'reviews', 'jumio']","$ 200.00",2013-07-30,1305,1,1,1,1
"665",8503329,0,"06-10-2014","","within an hour","100%","93%","t",2,2,"['email', 'phone', 'facebook', 'reviews']","$ 120.00",2014-10-06,872,1,1,1,1
"666",160594,0,"02-07-2011","We love having guests and sharing a piece of historic Asheville!","N/A","N/A","N/A","f",1,1,"['email', 'phone', 'reviews', 'kba']","$ 125.00",2011-07-02,2064,1,1,1,1
"667",11143250,0,"08-02-2016","","within an hour","100%","93%","f",1,1,"['email', 'phone', 'reviews']","$ 90.00",2016-02-08,382,1,1,1,1
"668",6452410,0,"26-05-2014","I am a Photographer, Visual Artist, Special FX make-up artist. 
My husband creates metal sculpture. 
We now have three grown boys and we are looking forward to traveling more.  
We enjoy spending time in NYC when not in Asheville. 
I am currently working on a book of photography called Disappearing American Dream. The project creates a platform for everyday Americans to tell their story and share their dream.
My Motto - ""Have Paint- Will Paint"" I have painted everything from cars, motor cycles, people, The Characters in Disney's Lion King, even the Dixie Chicks on the cover of Entertainment Weekly. 

My Husbands Motto- ""Perfection is the enemy of good""","within an hour","89%","100%","f",1,1,"['email', 'phone', 'reviews']","$ 115.00",2014-05-26,1005,1,1,1,1
"669",1212352,109,"28-05-2013","Hi!  I'm Reid, thanks for checking me out, here'a a little more about me.  I am a father,a realtor, a traveller, and ambassador for world peace.  I have really enjoyed being an AirBnB host, its great to meet new people and help them fall in love with Asheville.  I've lived here for over 20 years now and absolutely love this city.  I am happy share some of my Asheville favorites spots, insider tips, and things to do, so don't hesitate to ask me!","within a few hours","100%","100%","f",2,2,"['email', 'phone', 'reviews', 'kba']","$ 110.00",2013-05-28,1368,1,1,1,1
"670",11699287,109,"24-03-2013","I am an adventurer, keen observer and makerâ¦an artist and educator who travels somewhat frequently for art shows, teaching engagements and to rehydrate the creative sponge! I take great pride in creating an aesthetically pleasing and nurturing living space for myself and like the idea of opening my home as I so appreciate the opportunity to stay in others unique spaces while traveling.","N/A","N/A","N/A","f",1,1,"['email', 'phone', 'reviews', 'jumio']","$ 125.00",2013-03-24,1433,1,1,1,1
"671",1223655,0,"07-03-2011","Having lived in Asheville for 19 years, sharing tips about places to dine and things to do is a natural joy. I've been designing and developing properties for more than a decade. Creating spaces for guests to enjoy is a true labor of love! I also enjoy travel, and have integrated some architectural pieces I've gathered along the journey into some of my rentals. 
I'm so delighted to accommodate you, your family, and friends!","within an hour","100%","79%","f",8,8,"['email', 'phone', 'facebook', 'linkedin', 'reviews', 'kba']","$ 415.00",2011-03-07,2181,1,1,1,1
"672",6528101,0,"22-06-2011","I am a filmmaker and Arabic linguist and enjoy art, culture, food, dancing and travel.
I make many trips a year, particularly to North Africa and the Middle East and I love adventure and meeting new people.","within a day","90%","67%","f",1,1,"['email', 'phone', 'reviews']","$ 115.00",2011-06-22,2074,1,1,1,1
"673",4431352,110,"26-10-2014","I am a working professional in public health with Health and Human Services. I have lived in many different places in the US and served in the Peace Corps as a health sector Volunteer in the Dominican Republic. I sell my own art locally, have lots of friends and some family in the area. I love sharing my artistic space with friends and family and think it would be a great space for other people to enjoy while I am away visiting family up north for the holidays. I am clean, organized and thoughtful of others, when it come to sharing my space.","within a few hours","100%","85%","f",1,1,"['email', 'phone', 'reviews', 'kba']","$ 149.00",2014-10-26,852,1,1,1,1
"674",4449084,110,"23-10-2013","I like hosting because meeting new people is a great way to travel vicariously. I also like hosting because I'm from the southern part of the US and that's how we roll. I've got my own life to get on with, though, so my aim is to provide a comfortable, safe, and affordable place for you to perch on your visit.

I'm currently located in Asheville, NC, USA; the Edinburgh flat is no longer available.","N/A","N/A","N/A","t",1,1,"['email', 'phone', 'facebook', 'linkedin', 'reviews', 'jumio']","$ 60.00",2013-10-23,1220,1,1,1,1
"675",8634354,0,"29-09-2015","Ten years ago I rusticated to the mountains of Western North Carolina to immerse myself in the study of ceramics at the Penland School of Crafts where I have worked since 2006.

My ceramic studio here in Asheville is located at Grovewood Studios near The Grove Park Inn. I spend the majority of my time making one-of-a-kind hand-built ceramic functional ware and sculpture â Come visit my studio if you like.","within an hour","100%","91%","t",1,1,"['email', 'phone', 'reviews', 'kba']","$ 85.00",2015-09-29,514,1,1,1,1
"676",193830,75,"08-08-2011","I have travel in my blood. I was born in Chateauroux, France. My sister was born in Germany and I learned to speak German when my family lived there for four years. Some of my favorites places include, Lagos de Atitlan, Uxmal, Merida, San Cristobal, Antigua, Ambergris Caye, Chichicastengo, Amsterdam, Vancouver, Cologne, Berlin and Prague. I prefer to travel off the ""gringo trail"" and have many more places to visit. Open to house trade.

I am a passionate student of compassionate communication (NVC). Two important things I've learned is that other people's behavior rarely has anything to do with me and that with patience and compassion, most all our needs can be met. 

For fun around here I have ridden a hot air balloon over our mountains, taken a mountain top zip line tour nearby, seen our ancient mountains during a flying lesson, rented a scooter and rode the blue ridge parkway, took a few archery lessons so I could pretend to be like Katniss from The Hunger Games, which was filmed nearby. I also enjoy sitting in the backyard watching my chickens do goofy things. What do you like to do for fun? Let me share more fun things to do in our beautiful mountains.","within an hour","100%","99%","f",6,6,"['email', 'phone', 'reviews', 'kba']","$ 113.00",2011-08-08,2027,1,1,1,1
"677",6503015,0,"08-03-2012","At Peace","within an hour","100%","100%","f",1,1,"['email', 'phone', 'facebook', 'reviews', 'kba']","$ 95.00",2012-03-08,1814,1,1,1,1
"678",2326086,0,"06-05-2012","I am from Asheville NC.  I love to spend time outdoors, cooking and reading or listening to music.","within an hour","100%","95%","t",1,1,"['email', 'phone', 'reviews', 'kba']","$ 190.00",2012-05-06,1755,1,1,1,1
"679",1243512,0,"07-03-2011","Having lived in Asheville for 19 years, sharing tips about places to dine and things to do is a natural joy. I've been designing and developing properties for more than a decade. Creating spaces for guests to enjoy is a true labor of love! I also enjoy travel, and have integrated some architectural pieces I've gathered along the journey into some of my rentals. 
I'm so delighted to accommodate you, your family, and friends!","within an hour","100%","79%","f",8,8,"['email', 'phone', 'facebook', 'linkedin', 'reviews', 'kba']","$ 1550.00",2011-03-07,2181,1,1,1,1
"680",1245011,110,"27-06-2012","My husband, two children and I live in beautiful Asheville NC. We love our home and neighborhood and we love sharing it with guests from all over the country. We also have fun helping guests plan a fun weekend - where to eat, where to go, things to do and how to have a great time!","within a day","75%","71%","f",1,1,"['email', 'phone', 'facebook', 'reviews', 'kba']","$ 110.00",2012-06-27,1703,1,1,1,1
"681",4444689,0,"28-10-2014","","within a day","100%","86%","f",1,1,"['email', 'phone', 'reviews']","$ 225.00",2014-10-28,850,1,1,1,1
"682",233377,110,"08-08-2011","I have travel in my blood. I was born in Chateauroux, France. My sister was born in Germany and I learned to speak German when my family lived there for four years. Some of my favorites places include, Lagos de Atitlan, Uxmal, Merida, San Cristobal, Antigua, Ambergris Caye, Chichicastengo, Amsterdam, Vancouver, Cologne, Berlin and Prague. I prefer to travel off the ""gringo trail"" and have many more places to visit. Open to house trade.

I am a passionate student of compassionate communication (NVC). Two important things I've learned is that other people's behavior rarely has anything to do with me and that with patience and compassion, most all our needs can be met. 

For fun around here I have ridden a hot air balloon over our mountains, taken a mountain top zip line tour nearby, seen our ancient mountains during a flying lesson, rented a scooter and rode the blue ridge parkway, took a few archery lessons so I could pretend to be like Katniss from The Hunger Games, which was filmed nearby. I also enjoy sitting in the backyard watching my chickens do goofy things. What do you like to do for fun? Let me share more fun things to do in our beautiful mountains.","within an hour","100%","99%","f",6,6,"['email', 'phone', 'reviews', 'kba']","$ 124.00",2011-08-08,2027,1,1,1,1
"683",2296152,0,"16-07-2013","I am a professional musician. I teach private music lessons in my home and also do a lot of performing and am an adjunct professor of music.   I love to travel, meet people and do fun things. I am proud of my town and am happy to help visitors find the best experience.  I am really easy-going and have been renting rooms in my house for many years to people who need a place to stay for weeks, months or sometimes years.  Guests will have a comfortable home away from home with easy flexibility within the house to come and go as you please. (must love music!)

my life motto:  life is for fun!!!!","within an hour","100%","100%","t",3,3,"['email', 'phone', 'google', 'reviews', 'jumio']","$ 66.00",2013-07-16,1319,1,1,1,1
"684",11751136,0,"11-03-2016","","N/A","N/A","N/A","f",1,1,"['phone']","$ 175.00",2016-03-11,350,1,1,1,1
"685",4394761,0,"23-08-2014","I am a writer and musician. My husband is a visual artist and creative director for an advertising agency. Our wonderful kids are 5 and 9, play soccer, and love to camp and do outdoorsy things. We have been in Asheville for about 10 years and love it. We met in San Francisco, but moved here to start a family.","within an hour","100%","100%","f",2,2,"['email', 'phone', 'linkedin', 'reviews', 'jumio']","$ 86.00",2014-08-23,916,1,1,1,1
"686",8624659,110,"27-08-2015","I'm an Asheville native, and experienced local Realtor, who enjoys exploring the beautiful landscapes and delicious foodscapes this mountain city has to offer. My two wonderful children and I are proud (and lucky!) to call Asheville our home.","within a few hours","100%","100%","t",2,2,"['email', 'phone', 'linkedin', 'reviews', 'kba']","$ 180.00",2015-08-27,547,1,1,1,1
"687",6575162,0,"27-01-2014","Hello! My name is Ander and I have lived in Asheville for about 15 years. I love to travel, eat good food, see live music, and spend time with my 10 year old daughter. I have combined my talents for building and entertaining to create a really unique and fun vacation space. When I travel, I like to live-it-up, so I wanted to created that same kind of experience for my guests.","within an hour","100%","100%","t",2,2,"['email', 'phone', 'google', 'reviews', 'jumio']","$ 99.00",2014-01-27,1124,1,1,1,1
"688",5507900,0,"01-03-2015","","within an hour","100%","100%","f",1,1,"['email', 'phone', 'facebook', 'reviews', 'jumio']","$ 300.00",2015-03-01,726,1,1,1,1
"689",8664712,0,"01-10-2015","","within an hour","90%","100%","t",1,1,"['email', 'phone', 'linkedin', 'reviews', 'kba']","$ 175.00",2015-10-01,512,1,1,1,1
"690",8673686,0,"05-02-2014","Hi my name is Holly. I am an Asheville native. I have traveled for both work and leisure using airbnb.  I love the Arts, music, and food culture here in Asheville !  My airbnb rental was my primary home for 7 years I have put 100% love into it. And I am excited to accommodate travelers as a host!","within an hour","100%","100%","t",2,2,"['email', 'phone', 'facebook', 'linkedin', 'reviews']","$ 179.00",2014-02-05,1115,1,1,1,1
"691",6557001,0,"03-05-2015","We're Aria and Michael, from Asheville NC.
We love to travel and host, meeting and sharing with conscious community around the world.
Aria is a Special Needs teacher 
Michael is an Energy Healer
Together we enjoy (obviously) travel, yoga, art, music, hiking, and cooking and sleeping.
Thanks for being part of our life. 
Love and blessings","within an hour","100%","100%","f",1,1,"['email', 'phone', 'facebook', 'reviews', 'jumio']","$ 97.00",2015-05-03,663,1,1,1,1
"692",7627408,0,"22-07-2015","B and I are open minded, University of Georgia grads that have traveled the world and decided to call this wonderful/eclectic mountain town home! B is a local business owner and I'm a sales representative. We enjoy all things nature, craft brews, and our dog!  We look forward to having you in our home :)","within an hour","96%","98%","f",4,4,"['email', 'phone', 'google', 'reviews', 'jumio']","$ 189.00",2015-07-22,583,1,1,1,1
"693",2209375,110,"10-06-2012","I like to have fun & meet new people and hear about new experiences so as to expand my own understanding of this life.
I like to do fun building projects and see how I might take old materials and recreate them in a new fashion.
I am fairly laid back and I prefer to host people who are also laid back and appreciate bohemian lifestyles. 
I appreciate the urban and rural ways of life and try to live them both to the fullest.
I like new experiences so I've had a variety of jobs/careers: I've been a dishwasher; a farmer; a whitewater rafting guide, a wildland fire manager (in over half the country and other countries too); I served as Director of the Environmental Center @ the local University; got with some awesome colleagues and co-founded the Asheville Buncombe Food Policy Council, I proudly serve as a Guardian ad Litem (child advocacy in the court system) and I do a little community organizing around economic, environmental & overall social justice.

As far as how my style relates to you, my neighbor, I am real hands off! I have a full life and don't hang around too much....but when I do, I like to relax, converse and giggle.","within an hour","100%","100%","f",1,1,"['email', 'phone', 'linkedin', 'reviews', 'kba']","$ 215.00",2012-06-10,1720,1,1,1,1
"694",12105828,110,"10-10-2015","I own several properties throughout the Asheville area. My boys and I love living here...endless outdoor activities, great food, great entertainment, and an abundance of great people.","within an hour","100%","100%","f",2,2,"['email', 'phone', 'facebook', 'reviews']","$ 190.00",2015-10-10,503,1,1,1,1
"695",2411109,0,"16-07-2013","I am a professional musician. I teach private music lessons in my home and also do a lot of performing and am an adjunct professor of music.   I love to travel, meet people and do fun things. I am proud of my town and am happy to help visitors find the best experience.  I am really easy-going and have been renting rooms in my house for many years to people who need a place to stay for weeks, months or sometimes years.  Guests will have a comfortable home away from home with easy flexibility within the house to come and go as you please. (must love music!)

my life motto:  life is for fun!!!!","within an hour","100%","100%","t",3,3,"['email', 'phone', 'google', 'reviews', 'jumio']","$ 66.00",2013-07-16,1319,1,1,1,1
"696",579405,110,"08-08-2011","I have travel in my blood. I was born in Chateauroux, France. My sister was born in Germany and I learned to speak German when my family lived there for four years. Some of my favorites places include, Lagos de Atitlan, Uxmal, Merida, San Cristobal, Antigua, Ambergris Caye, Chichicastengo, Amsterdam, Vancouver, Cologne, Berlin and Prague. I prefer to travel off the ""gringo trail"" and have many more places to visit. Open to house trade.

I am a passionate student of compassionate communication (NVC). Two important things I've learned is that other people's behavior rarely has anything to do with me and that with patience and compassion, most all our needs can be met. 

For fun around here I have ridden a hot air balloon over our mountains, taken a mountain top zip line tour nearby, seen our ancient mountains during a flying lesson, rented a scooter and rode the blue ridge parkway, took a few archery lessons so I could pretend to be like Katniss from The Hunger Games, which was filmed nearby. I also enjoy sitting in the backyard watching my chickens do goofy things. What do you like to do for fun? Let me share more fun things to do in our beautiful mountains.","within an hour","100%","99%","f",6,6,"['email', 'phone', 'reviews', 'kba']","$ 113.00",2011-08-08,2027,1,1,1,1
"697",8782463,0,"12-01-2014","","within an hour","100%","100%","f",1,1,"['email', 'phone', 'reviews', 'kba']","$ 39.00",2014-01-12,1139,1,1,1,1
"698",9794899,1,"03-12-2015","","within an hour","100%","100%","f",1,1,"['email', 'phone', 'reviews', 'kba']","$ 195.00",2015-12-03,449,1,1,1,1
