"","ï..id","booked","host_since","host_about","host_response_time","host_response_rate","host_acceptance_rate","host_is_superhost","host_listings_count","host_total_listings_count","host_verifications","price","host_since_frm","days_since","email","social","phone","reviews"
"183",3821004,0,"30-03-2011","I have lived all over the world and have found myself in Asheville for the past 8 years.  This place is magic! I am a holistic heath practitioner with over 20 years experience in healing arts.  I practice transpersonal hypnosis, energy medicine and cranio sacral therapy as well as somato emotional release.  I have an office 2 miles from my home.  I am also a professional archery instructor and owner of Artemis Archery Asheville.  Essentially I am an easy going host with a wealth of healing and Asheville knowledge.  I dance, enjoy archery, hiking and laughing.","within a day","90%","75%","f",1,1,"['email', 'phone', 'reviews']","$ 55.00",2011-03-30,2158,1,1,1,1
"184",725030,111,"28-09-2012","Hi.    I'd love to have you stay with me on your visit in Asheville.   I've had such wonderful guests from Airbnb!

Hopefully, you'll love my location and how easy it is to walk to great things as much as I do- and you'll get a little taste of what it's like to live here. 

My dog and cat love having company!  
Please join us!   Cheryl","within a few hours","100%","97%","f",2,2,"['email', 'phone', 'facebook', 'reviews', 'kba']","$ 70.00",2012-09-28,1610,1,1,1,1
"185",6972023,0,"15-07-2013","","N/A","N/A","N/A","f",1,1,"['email', 'phone', 'facebook', 'reviews', 'kba']","$ 108.00",2013-07-15,1320,1,1,1,1
"186",638349,0,"01-07-2012","My daughter Rosa and I share our West Asheville home with our indoor cat, Joey and our sweet dog, Fina.  We have been here for almost 10 years now.  We love to travel, camp, hike, and otherwise enjoy all that Western North Carolina offers.  I lived in Europe for two years and have subsequently traveled extensively, mostly in Central and South America.  I am a Spanish teacher and musician and love to work with children and adults.  I practice yoga, love to read, dance, eat out, and socialize, and feel fortunate to have wound up in this great city of Asheville with my fascinating and fabulous daughter.","within an hour","100%","100%","f",2,2,"['email', 'phone', 'facebook', 'reviews', 'kba']","$ 122.00",2012-07-01,1699,1,1,1,1
"187",9903083,0,"03-10-2013","Hello!   My name is Shawn.  I'm an Asheville native.  I enjoy motorcycles, web design, and real estate.  I know all of the best places to eat and all of the best breweries in town.  I'm a people person when I'm not running around town with my two dogs.","within an hour","100%","100%","f",3,3,"['email', 'phone', 'facebook', 'google', 'reviews', 'kba']","$ 39.00",2013-10-03,1240,1,1,1,1
"188",12233283,111,"26-02-2012","I'm an entrepreneur and an artist. Hardworking, focused, looking to travel and work remotely, and be able to vacation some while doing it. I used to manage University residence halls, so I'm familiar with what it's like to host people and run a community. I'm a quiet, responsible, and respectful guest. Easy-going and relaxed. 

I own and lead a boutique creative agency that focuses on branding, design, and development. I have a small team in Boulder, Asheville, and LA. I am also a producer of a national tv show, as well as a writer and poet. 

You can find out more about me at:

(URL HIDDEN)
(URL HIDDEN)","N/A","N/A","100%","f",1,1,"['email', 'phone', 'facebook', 'reviews', 'jumio']","$ 90.00",2012-02-26,1825,1,1,1,1
"189",12252099,111,"21-03-2016","","within an hour","100%","100%","f",1,1,"['email', 'phone', 'google', 'jumio']","$ 60.00",2016-03-21,340,1,1,1,1
"190",718084,111,"28-09-2012","Hi.    I'd love to have you stay with me on your visit in Asheville.   I've had such wonderful guests from Airbnb!

Hopefully, you'll love my location and how easy it is to walk to great things as much as I do- and you'll get a little taste of what it's like to live here. 

My dog and cat love having company!  
Please join us!   Cheryl","within a few hours","100%","97%","f",2,2,"['email', 'phone', 'facebook', 'reviews', 'kba']","$ 70.00",2012-09-28,1610,1,1,1,1
"191",3868452,0,"08-08-2014","Hello! Thank you for looking at my profile. I have been a massage therapist for over 14 years. I have been living in Asheville, NC for over 10 years. I love to create art, hike in our beautiful mountains, sail, read books, dine on fabulous food.... My husband and I used to live in beautiful Sedona, AZ. We love to travel and visit new places.","within an hour","100%","100%","t",1,1,"['email', 'phone', 'facebook', 'reviews', 'kba']","$ 225.00",2014-08-08,931,1,1,1,1
"192",11208688,111,"11-02-2016","I'm a retired social worker turned dog behavior counselor/trainer. I grew up in the Washington DC area and have lived in London, England and New Mexico, US. Now happily residing in Asheville, NC, I am enjoying the mountains and friendly people. Also the wonderful food!
Back in Maryland, I had a basement apartment I renovated and rented out. And now I am excited to share my beautiful Asheville home with Airbnb guests!
Coming from a very diverse area, I love that Asheville's own diversity is increasing. All are welcome in my home and I do not discriminate on the basis of anything.","within an hour","100%","80%","f",1,1,"['email', 'phone', 'facebook', 'google', 'reviews', 'jumio']","$ 55.00",2016-02-11,379,1,1,1,1
"193",8064417,0,"24-09-2014","","within a few hours","100%","100%","f",1,1,"['email', 'phone', 'google', 'reviews', 'kba']","$ 300.00",2014-09-24,884,1,1,1,1
"194",4931736,0,"30-12-2014","We are a family of four with a 2 year old girl and 5 month old boy.","within a day","50%","0%","t",1,1,"['email', 'phone', 'linkedin', 'reviews', 'jumio']","$ 100.00",2014-12-30,787,1,1,1,1
"195",5890497,0,"28-09-2014","My husband and I enjoy meeting people and sharing our vision for healthy homes and relationships. Our lives and work are focused on a mindful awareness, conscious communication, and community building. We love sharing our home with those wishing to visit the area to explore the beautiful Blue Ridge mountains along with the creative and progressive energy of Asheville....","within a few hours","100%","100%","t",2,2,"['email', 'phone', 'google', 'reviews', 'kba']","$ 65.00",2014-09-28,880,1,1,1,1
"196",9131234,111,"28-08-2013","Don't worry, be happy.   Enjoy exploring new places, museums, reading, gardening, and riding horses.","within a few hours","100%","94%","t",1,1,"['email', 'phone', 'reviews']","$ 95.00",2013-08-28,1276,1,1,1,1
"197",5716399,0,"16-05-2012","We are from the Mountains of Western North Carolina. David is a contractor, specializing in GreenBuilding and Melissa is a Physician Assistant at a Family Practice. 
We to love travel, play outdoors with our dog and enjoy all the great restaurants Asheville has to offer.","within an hour","100%","100%","f",2,2,"['email', 'phone', 'google', 'linkedin', 'reviews', 'kba']","$ 115.00",2012-05-16,1745,1,1,1,1
"198",8841337,0,"11-10-2015","I am an owner of a local Craft Cider company, used to make kids TV in the UK and also was Therapist working with children with autism for a couple of years. I like to be available to my guests if they need anything, but then like to give them the space to relax and feel at home without interruption.","within a day","100%","0%","f",1,1,"['email', 'phone', 'facebook', 'reviews', 'kba']","$ 100.00",2015-10-11,502,1,1,1,1
"199",3095136,0,"18-05-2014","","within an hour","100%","86%","t",3,3,"['email', 'phone', 'google', 'reviews', 'jumio']","$ 165.00",2014-05-18,1013,1,1,1,1
"200",768598,0,"04-11-2012","Meredith and I love to share our beautiful area. She grew up in the Washington DC area, has family connections to NC, and attended Duke graduate school. I grew up in Eastern Pennsylvania, my family is from NC, coastal SC.  I went to UNC-CH. 

We live in the mountain oasis of Asheville.  We love to travel, cycling of all kinds and a variety of outdoor activities, also I have a penchant for things mechanical.","within a few hours","100%","33%","t",1,1,"['email', 'phone', 'reviews', 'kba']","$ 150.00",2012-11-04,1573,1,1,1,1
"201",7064317,0,"29-06-2015","HI!

I'm Vicki, a native of Asheville, and my husband, Tom, relocated from Boston 15 years ago.  Yes, he still says ""khakis"" for ""car keys"", but I can translate  if needed!  Just kidding...his accent is just one of the  many things I love about him!

Both of us work full time - I'm a dental hygienist, and Tom, an IT Specialist.  We enjoy every minute we get to spend at home, and also love being with our kids and grand kids, our 2 dogs, going to dinner and movies, being out on the pontoon boat at Lake Fontana in the summer, working around the house, or just relaxing (our favorite)!  We recently bought 2 double floats and did some lazy tubing on the French Broad!  We enjoyed it so much, we'll probably be ""floating"" every chance we get!  It was beautiful and so relaxing!  If you're in Asheville during the summer months and like being in the water, we highly recommend it! 

We adore Asheville and the surrounding areas, especially the mountains.  I've always felt comforted and protected by them for some reason.  Sometimes you might hear them   whispering to you, but you have to learn to listen closely, and it helps to use your imagination :)   

Getting to meet and enjoy good people from all cultures is one of life's greatest privileges.  Plus it's exciting to know there are so many warm, interesting, and kind people that may cross our paths.  We're looking forward to welcoming you to Asheville and into our home.  Our hope is that our little slice of heaven will serve you well and be a respite for you during your visit.   We will be as interactive as you wish, but our goal is to honor and respect your privacy, thus we will never be intrusive.  We can't wait to meet you!","within a day","50%","100%","t",1,1,"['email', 'phone', 'facebook', 'linkedin', 'reviews', 'kba']","$ 78.00",2015-06-29,606,1,1,1,1
"202",11259371,111,"25-03-2013","Lived in Tampa for over 20 years and moved to Asheville without ever visiting and LOVED it!  My boyfriend Shane and I live here with a couple of cute dogs and even cuter kids. 
I run an online vintage store and my favorite thing to do is go to the beach, check out small local businesses, like cafes and boutiques, and take my kids to parks or fun family events, and I love to read!","within an hour","100%","100%","f",1,1,"['email', 'phone', 'reviews']","$ 79.00",2013-03-25,1432,1,1,1,1
"203",12310425,0,"27-03-2016","","within a few hours","100%","100%","f",1,1,"['email', 'phone']","$ 325.00",2016-03-27,334,1,1,1,1
"204",4984181,0,"01-01-2015","Hi there!  We are Dawn and Ben, and we are happy that you are interested in our space!
  Dawn has been in Asheville over 20 years, though she spent a hefty portion of that time traveling the world.  She's been working for a local bike shop the last 7 years, where she is still employed, and is also currently in school for Nursing.  She loves being outside, running, and camping, but is most elated when she's on her mountian bike in the woods ripping along beautiful single track. 
Ben moved to Asheville for the mountain biking 13 years ago.  He worked in the bike industry for over 15 years.  He now works as an off-road driving instructor for Land Rover on the Biltmore Estate.  In his free time he enjoys spending time with his daughter Macy, fiancee Dawn, tinkering on his Classic Range Rover and mountain biking.","within an hour","100%","100%","f",1,1,"['email', 'phone', 'facebook', 'linkedin', 'reviews', 'kba']","$ 90.00",2015-01-01,785,1,1,1,1
"205",12325459,111,"04-02-2016","Cody & Marla have lived here is Asheville for many years and love it here.  We enjoy many of wonderful natural setting of the area.  We have three teenagers and two cats.  We spend a lot of time camping on a lake with our Pontoon & Sailboat which allows us the opportunity allow you to stay in the house while we are off playing.  We hope you enjoy Asheville as much as we do.","within an hour","100%","100%","f",2,2,"['email', 'phone', 'facebook', 'reviews']","$ 50.00",2016-02-04,386,1,1,1,1
"206",6566070,0,"27-05-2015","I am a small business owner and an urban organic farmer who loves animals as well. I am a gypsy at heart and in 1999 decided to make Asheville my home. After traveling the U.S. for almost 2 years it felt great to throw down some roots. Those roots have dug in deep!! Being an entrepreneur in a community that thrives on, supports and is loyal to us small business folks is both a joy and an honor.
Being a host gives me the opportunity to share with so many different folks all the things I truly love about the Asheville community.","within an hour","100%","100%","t",1,1,"['email', 'phone', 'google', 'reviews', 'kba']","$ 160.00",2015-05-27,639,1,1,1,1
"207",1325364,0,"30-06-2013","I have lived in Asheville since 2002 first working for Outward Bound and now teaching middle school science.  I love to travel am so happy to help others out as they explore Asheville!  I do quite a bit of running and triathlon racing so that keeps me busy with races, long runs or rides on weekends so I am often not home much. I look forward to meeting you!","within an hour","100%","100%","t",1,1,"['email', 'phone', 'facebook', 'reviews', 'kba']","$ 75.00",2013-06-30,1335,1,1,1,1
"208",11291801,0,"13-09-2015","","within an hour","100%","100%","f",1,1,"['email', 'phone', 'facebook', 'reviews']","$ 165.00",2015-09-13,530,1,1,1,1
"209",2943116,110,"02-05-2014","Easy going friendly and very helpful.  I love life, good food and good friends.  I love to meet nice people and help them have a wonderful stay in Asheville.  My motto is lfe is short - order dessert first.  :-)","within an hour","100%","100%","t",1,1,"['email', 'phone', 'facebook', 'reviews', 'kba']","$ 100.00",2014-05-02,1029,1,1,1,1
"210",2949571,0,"03-05-2014","We are artist/musicians living in Asheville with our 2 boys and a few pet chickens.
We enjoy gardening & landscaping our peaceful sanctuary.
We are openminded, humorous, non-judgmental, vegetarian,  balanced between urban/rural, into nature, arts, electronic music, philosophy, astronomy, archaeology, and respectful of all life. :)

As hosts, we try to be easy going and accommodating as possible.
As guests, we live by the Leave No Trace principal and/or the ""leaving it nicer than you found it"" principal. :)","within a few hours","100%","95%","t",1,1,"['email', 'phone', 'facebook', 'reviews', 'jumio']","$ 94.00",2014-05-03,1028,1,1,1,1
"211",11343133,0,"09-04-2014","I love color, married a artist and live in one of the most comfortable and colorful homes in West Asheville (and that's saying something in this neighborhood!) My partner Thomas and I decided to move to Asheville after visiting over my birthday weekend two years ago (via Airbnb). We instantly fell in love with the town's charm and haven't looked back

I moved to Asheville from the Washington DC area almost 2 years ago and I love the small town feel, the natural beauty, the southern friendliness and the strong sense of community. I'm blessed to work from home as a consultant for the United Nations, so I get to interact with folks literally all over the world, from the comfort of my home office. I've lived in Sierra Leone and Guatemala and have traveled to a handful of other countries in Europe, the Caribbean and Central America. I've also lived in various cities on both coasts of the US, yet very serendipitously rooted here in Asheville, North Carolina (happy to share that story with you when we meet.) So yes, I love to travel, connect with new people, learn about the many cultures that exist in any particular space and place.

With an active yoga practice, attempts at gardening, a six year old son with an active social calendar, and baby #2 on the way, life is ever expressing joy.","within a few hours","100%","95%","f",1,1,"['email', 'phone', 'facebook', 'reviews', 'jumio']","$ 45.00",2014-04-09,1052,1,1,1,1
"212",10298936,0,"03-10-2013","Hello!   My name is Shawn.  I'm an Asheville native.  I enjoy motorcycles, web design, and real estate.  I know all of the best places to eat and all of the best breweries in town.  I'm a people person when I'm not running around town with my two dogs.","within an hour","100%","100%","f",3,3,"['email', 'phone', 'facebook', 'google', 'reviews', 'kba']","$ 39.00",2013-10-03,1240,1,1,1,1
"213",3990524,0,"30-01-2012","I spent my entire adult life in theatre as an actress, director and producer. Nearly 20 years of that I created original works with objects and puppets. My work has been seen at The Kennedy Center, the Henson International Festival in N.Y., UCLA, and the Walker Arts Center, to name a few.  I tired of the touring life however and am now making beautiful handmade art lamps inspired by a 2 year stay in Korea.  I love my hours in the studio which is located in Asheville's River Arts District!  I must still travel some to get my wares out into the public, but with a studio in the district, many travelers come my way. 

I love to meet new people. I'm friendly and easy to get along with.  With all the traveling done over the years I am quite self sufficient.  Good food is important when you're on the road, and I love to find those special little places tucked away in a neighborhood. As a host, I will be able to point you in the right direction for a wonderful night on the town. 

My motto is - ""Be positive and enjoy the ride.""","within a few hours","100%","83%","t",1,1,"['email', 'phone', 'facebook', 'reviews']","$ 45.00",2012-01-30,1852,1,1,1,1
"214",6813265,0,"18-04-2015","I am a 45 yr old female. I lived in WY near the Tetons for 13 yr and now reside in Asheville, NC. My child is my job; I am an acupuncturist (& also a science enthusiast) & work with my patients using vitamins, herbs, & nutrition. I love to travel & meet people & enjoy delicious &/or interesting food, and love music & the outdoors. I especially love anything to do with the water! (I used to coach swimming& swam competitively).  I love world music, funk, and bluegrass. Like I said , I love to travel but these days I am limited due to my work (which I love) and needing to be near to my parents (who I used to never see when I was away all the time).","within a few hours","100%","100%","f",1,1,"['email', 'phone', 'linkedin', 'reviews', 'kba']","$ 58.00",2015-04-18,678,1,1,1,1
"215",1950593,0,"21-05-2013","We are wildlife photographers, film-makers, and writers who edit Travel For Wildlife, a website dedicated to adventure wildlife travel. We have lived in Asheville for three years with our two cats Scamper and Sadie. We love to travel the world to look for animals and we love to come home to our cozy house in the woods!","within a day","96%","99%","t",2,2,"['email', 'phone', 'facebook', 'reviews', 'jumio']","$ 110.00",2013-05-21,1375,1,1,1,1
"216",6150459,0,"31-05-2013","I love to read, travel, and spend time with family. I also enjoy sharing how amazing Asheville is with other travelers!","within a day","90%","88%","t",2,2,"['email', 'phone', 'facebook', 'google', 'reviews', 'jumio']","$ 199.00",2013-05-31,1365,1,1,1,1
"217",11396796,112,"23-09-2013","More info on it's way.","within a few hours","100%","96%","f",1,1,"['email', 'phone', 'facebook', 'reviews', 'jumio']","$ 70.00",2013-09-23,1250,1,1,1,1
"218",5114762,112,"15-09-2014","An Asheville transplant, I have watched our West Asheville grow into a diverse community with numerous food eateries, music venues, shops and even a gas station with a pub.  I love our community and spend part of my time promoting the Greenway projects across the Asheville area and beyond. 
  
My partner Wynn and I have been living in our home since 2008 and have found that Asheville offers a lifestyle that encourages quality of life.   We look forward to sharing our experience on a visit very soon. Live, Laugh, Love!   

Grandmother of two gorgeous boys, I look forward to sharing my home with people coming to experience the Asheville scene.  My home is open and inviting and within walking distance to all the West Asheville Amenities.

I own a small real estate business, Sweetwater Realty, yes named after the beer from Atlanta.  We love our beers in Asheville.

Live, Laugh and Love!  I look forward to seeing you soon.","within an hour","100%","100%","t",1,1,"['email', 'phone', 'facebook', 'google', 'reviews', 'kba']","$ 80.00",2014-09-15,893,1,1,1,1
"219",3018908,0,"01-05-2014","","within an hour","100%","100%","t",2,2,"['email', 'phone', 'google', 'reviews', 'kba']","$ 215.00",2014-05-01,1030,1,1,1,1
"220",5464591,0,"25-02-2015","We are an artsy and natural family of three who love music, art, yoga, meditation, gardening, cooking and wordly travel.  We were married in late 2010 and have traveled over 2 out of the last 4 years in various countries and have circled the globe twice.  We are good hearted, simple people and are excited to share our cute and cozy home with you!","within an hour","100%","100%","f",1,1,"['email', 'phone', 'facebook', 'reviews', 'jumio']","$ 300.00",2015-02-25,730,1,1,1,1
"221",12468460,112,"15-11-2012","","within an hour","100%","100%","f",1,1,"['email', 'phone', 'facebook']","$ 60.00",2012-11-15,1562,1,1,1,1
"222",7276342,0,"09-02-2015","I am a martial arts student,  gardener and artist. I love living here in the mountains,  and really enjoy meeting new people and sharing my life experiences. My passions are in music and living a balanced happy life with my children and my pet family!","within an hour","100%","100%","f",1,1,"['email', 'phone', 'facebook', 'reviews', 'kba']","$ 75.00",2015-02-09,746,1,1,1,1
"223",6271061,112,"18-06-2011","We're open hearted and open minded, creative, love to travel, and enjoy the beauty of everyday life with our adorable kids.","N/A","N/A","N/A","f",1,1,"['email', 'phone', 'facebook', 'reviews']","$ 70.00",2011-06-18,2078,1,1,1,1
"224",10476149,0,"24-01-2015","","N/A","N/A","N/A","f",2,2,"['email', 'phone', 'facebook', 'reviews', 'kba']","$ 150.00",2015-01-24,762,1,1,1,1
"225",2014453,0,"21-05-2013","We are wildlife photographers, film-makers, and writers who edit Travel For Wildlife, a website dedicated to adventure wildlife travel. We have lived in Asheville for three years with our two cats Scamper and Sadie. We love to travel the world to look for animals and we love to come home to our cozy house in the woods!","within a day","96%","99%","t",2,2,"['email', 'phone', 'facebook', 'reviews', 'jumio']","$ 105.00",2013-05-21,1375,1,1,1,1
"226",817865,0,"01-12-2012","We LOVE alternative dwellings and micro housing. We ourselves live in a  270 sq ft vintage camper with our three dogs. We have really been enjoying the opportunity to share our land with guests and have met so many amazing people through hosting on AIRBNB.   Together, Josh and I own two pieces of land in Asheville. One has just the yurt alone on it. Our other property is home to Bettie and also has several private campsites. It's nice to be able to offer people a range of options- from camping on the cheap to enjoying a luxurious stay in our yurt or restored vintage trailer! Joanna owns an environmentally conscious cleaning company in Asheville, Clean Green Asheville. Josh makes tactical gear like tourniquet holders and works out of his airstream shop. We are both very friendly and active people and we do all of the work on both properties ourselves :-)","within an hour","100%","84%","t",5,5,"['email', 'phone', 'reviews', 'jumio', 'kba']","$ 160.00",2012-12-01,1546,1,1,1,1
"227",5152307,0,"24-01-2015","","N/A","N/A","N/A","f",2,2,"['email', 'phone', 'facebook', 'reviews', 'kba']","$ 135.00",2015-01-24,762,1,1,1,1
"228",9884274,0,"06-08-2013","I like to work hard and play hard. I am easy going. I love travel and love hosting travelers. I am a father of a beautiful 18 year old.","within an hour","100%","94%","t",2,2,"['email', 'phone', 'facebook', 'reviews', 'jumio']","$ 37.00",2013-08-06,1298,1,1,1,1
"229",1497710,112,"08-05-2012","We are both young professionals from Asheville. We both work in elementary schools. We both enjoy outdoor activities and travel as much as we can. We are professional, honest, and reliable.","within an hour","100%","100%","t",1,1,"['email', 'phone', 'facebook', 'reviews', 'kba']","$ 85.00",2012-05-08,1753,1,1,1,1
"230",3089882,0,"23-03-2013","I live in Asheville, North Carolina.  I am an ecologist, botanist, writer, yogi, and qigong instructor.  I am an avid outdoorsman, hiker/walker, climber, runner, spelunker, soccer/football player, and amateur mythologist.","within an hour","100%","92%","t",1,1,"['email', 'phone', 'reviews', 'kba']","$ 55.00",2013-03-23,1434,1,1,1,1
"231",6765734,0,"26-06-2011","We operate two traveler's hostels located in Historic West Asheville, and in Wilmington, NC. Both locations offer wifi and Internet access, full kitchen and bathroom, book exchange and common areas, and bikes to borrow.","within a few hours","100%","68%","f",6,6,"['email', 'phone', 'facebook', 'reviews']","$ 24.00",2011-06-26,2070,1,1,1,1
"232",6765832,0,"26-06-2011","We operate two traveler's hostels located in Historic West Asheville, and in Wilmington, NC. Both locations offer wifi and Internet access, full kitchen and bathroom, book exchange and common areas, and bikes to borrow.","within a few hours","100%","68%","f",6,6,"['email', 'phone', 'facebook', 'reviews']","$ 72.00",2011-06-26,2070,1,1,1,1
