"","ï..id","booked","host_since","host_about","host_response_time","host_response_rate","host_acceptance_rate","host_is_superhost","host_listings_count","host_total_listings_count","host_verifications","price","host_since_frm","days_since","email","social","phone","reviews"
"413",304379,0,"04-01-2012","I like putting people and environments together and have converted my art studio to a rental cottage to do just that.  Since graduating from Carnegie Mellon as a painter, A LONG TIME AGO, I have had many creative occupations including theater, film, interior design and teaching. A strong desire to share the property that my husband and I have sculpted together for 15 years has led to the conversion of a free standing art studio to RACK FOCUS COTTAGE  (304379). The need for a 3 BR led to the renovation of RACK FOCUS (PHONE NUMBER HIDDEN)) . Because this property is right across the street from the cottage, its guests can easily share the wooded walk, creek sitting,meadow and fire pit of the park-like setting of the cottage. Similarly furnished and appointed it is ideal for larger groups. We love to travel but this is our favorite destination. Make Asheville yours. Stay with us.  Short, extended stay or long term.","within a few hours","100%","100%","f",2,2,"['email', 'phone', 'facebook', 'linkedin', 'reviews', 'kba']","$ 189.00",2012-01-04,1878,1,1,1,1
"414",7662484,0,"27-04-2012","We are a retired couple, John ( consultant/writer) and Lou (nurse) We love to travel and prefer to rent apartments rather than hotel rooms so as to fully appreciate the experience . 
Asheville has been home since we moved from DC in 2006 and every day  has been filled with the joy of discovering all that drew us here: music and  mountains, food and festivals , dog parks and bookstores and plenty of charming souls to keep us here. 
We've taken care to provide a space WE would stay in, that our family and friends will come to call home â¦and where you will discover your very own Asheville.","within an hour","100%","100%","t",1,1,"['email', 'phone', 'reviews', 'jumio']","$ 105.00",2012-04-27,1764,1,1,1,1
"415",3116699,0,"18-05-2014","","within an hour","100%","86%","t",3,3,"['email', 'phone', 'google', 'reviews', 'jumio']","$ 180.00",2014-05-18,1013,1,1,1,1
"416",11864862,0,"11-06-2014","I am a freelance IT Director and an ARTIST. I live, teach and play in the greatest city in the world...Asheville, NC.","within an hour","100%","100%","f",2,2,"['email', 'phone', 'facebook', 'google', 'reviews', 'kba']","$ 125.00",2014-06-11,989,1,1,1,1
"417",11865423,0,"11-06-2014","I am a freelance IT Director and an ARTIST. I live, teach and play in the greatest city in the world...Asheville, NC.","within an hour","100%","100%","f",2,2,"['email', 'phone', 'facebook', 'google', 'reviews', 'kba']","$ 88.00",2014-06-11,989,1,1,1,1
"418",2432326,0,"20-02-2014","I've lived in Asheville for over 13 years and am known by many as at least one of the following: Entrepreneur, Innovator, Designer, Writer, Astrologer, Healer, Massage Therapist, Human Design student, Projector, Yoga Enthusiast, Artist, Vegetarian, Mother with 23 year old son, Zach, living with me. I am available for astrology readings, healings, advice on Best of Asheville including Best Yoga classes, Best waterfall hikes, Best places to eat etc.","within a few hours","100%","100%","t",1,1,"['email', 'phone', 'reviews']","$ 111.00",2014-02-20,1100,1,1,1,1
"419",1392363,110,"16-07-2013","","N/A","N/A","N/A","f",1,1,"['email', 'phone', 'facebook', 'google', 'kba']","$ 96.00",2013-07-16,1319,1,1,1,1
"420",815068,0,"05-09-2011","I grew up in Asheville and have had a variety of different careers from being a probation officer for 4 years, just out of college,  then 16 years in banking and finance  then owning  a restaurant in downtown Asheville in the 1990's and then starting a gift and garden retail store (Thyme In The Garden)  7 years ago, which I sold my interest in this year to my former wife.  In the last three years I have become a fixture at the YMCA, lost a lot of weight, have developed an interest poetry, reading and embarrassing attempts at writing. I also love to cook and play golf, but have little time from either this year.","within an hour","100%","100%","t",1,1,"['email', 'phone', 'facebook', 'reviews']","$ 99.00",2011-09-05,1999,1,1,1,1
"421",2459487,0,"30-12-2013","My name is Julia. I'm a middle aged woman living a good life in Asheville. I have lived here  for 11 years  and love to call it home. I enjoy Asheville for the beauty of the place, the great music and food, the open minded and the warmth of the people. It's a great town. 
Before I was living in Charlotte NC for many years and long time ago I lived in Colombia S A, where I was born. 
I love to travel, experience different cultures and try different kinds of food. My favorite hobby is to make handcrafted jewelry.","within an hour","100%","50%","f",2,2,"['email', 'phone', 'google', 'reviews', 'manual_offline', 'jumio']","$ 100.00",2013-12-30,1152,1,1,1,1
"422",9773778,0,"09-08-2012","We love Asheville and enjoy exploring other destinations around the world.","within a few hours","100%","83%","f",22,22,"['email', 'phone', 'google', 'reviews']","$ 335.00",2012-08-09,1660,1,1,1,1
"423",11871844,0,"16-03-2016","We are outgoing, fun-loving folks that love to laugh.  Steve is a retired fire Chief from New Orleans and I am a wannabe retiree but love my job so much that I cannot see my self ever stopping (in the near future).  Steve says he works more now than when he had 400 firemen that answered to him.  He is always helping a neighbor or a friend (sometimes people he does not even know) with projects around their homes.  I sell residential real estate and farms and land.  Land is what I really enjoy the most!  What better job could you have than one where you get to go outdoors, hike property and find just the right fit for the right folks.  

Steve and I love to travel - usually to a beach or to visit friends and our children and lovely grandchildren.  When we are not working, we are on the Harley taking small rides in these beautiful Appalachian Mountains.  

Abner's Cabin has been a vacation rental since 2006 and we have many return travelers.  We have met some awesome people of whom many have become friends over the years.  We truly care about your comfort and want to make sure you are lacking in nothing when you arrive.","within a day","70%","100%","f",1,1,"['phone', 'google', 'jumio']","$ 135.00",2016-03-16,345,1,1,1,1
"424",11882197,110,"17-03-2016","","within an hour","100%","100%","f",1,1,"['phone', 'reviews']","$ 68.00",2016-03-17,344,1,1,1,1
"425",6713809,110,"27-01-2013","I am a full time student and full time employee. I a the proud mother of a 7yr old fur baby that lights up my life!! :)

I don't have a lot of free time but when I do have it i enjoy taking a yoga class or volunteering for PSR or Global Zero. 

I love natural lighting and lots of plants...but unfortunately I have been too busy this year to rebuild my indoor garden. :( 

But there is fresh garden thyme, lemon grass & sweet marjoram growing in hanging baskets on the porch! Please feel free to enjoy them in whatever meals you prepare!

PS: I do not provide toilet paper, paper towels or any such items! As I typically only rent my home out when I am out of the country!","N/A","N/A","N/A","f",1,1,"['email', 'phone', 'facebook', 'reviews']","$ 130.00",2013-01-27,1489,1,1,1,1
"426",12093776,0,"16-10-2012","Cosmic mermaid with a bit of an eclectic and eccentric sense of life.  Adventuresome spirit who enjoys connecting with others and would love to host as many travelers as possible! Loves stories from both near and far, as well as expanding her network on the global grid.  Thanks for your interest, she is already looking forward to your stay :)","within an hour","100%","100%","f",5,5,"['email', 'phone', 'facebook', 'google', 'linkedin', 'reviews', 'jumio']","$ 145.00",2012-10-16,1592,1,1,1,1
"427",5822540,111,"19-01-2014","I've owned and managed Hill House, a 4-star, 10-room inn just north of downtown Asheville since February 2012. It's not on AirBnB. This is my personal home, which I either like to book when I take a vacation or at times book the guest room to a traveler. I treat my guests here, just as I treat those at Hill House.","within an hour","100%","N/A","f",2,2,"['email', 'phone', 'google', 'reviews', 'jumio']","$ 89.00",2014-01-19,1132,1,1,1,1
"428",1651509,0,"13-10-2011","","within an hour","100%","100%","t",1,1,"['email', 'phone', 'facebook', 'reviews']","$ 125.00",2011-10-13,1961,1,1,1,1
"429",9022733,111,"16-01-2015","Hi,

As a guest, I'm typically traveling for short business trips. I help clients with  technology strategy, process and organizational problems. I'm an easy guest as I'm typically at client sites during the day and happy with internet access and a quiet room for the night. Having spent much of my career traveling and staying in hotels, I much prefer meeting new people and having a more relaxed place to stay via Airbnb.

When I'm traveling for fun my wife and I enjoy experiencing different cultures, food, nature, the arts and architecture. My favorite travel destinations tend to be mountain areas in the US and Europe (Italy in particular).","N/A","N/A","N/A","f",1,1,"['email', 'phone', 'linkedin', 'reviews', 'kba']","$ 150.00",2015-01-16,770,1,1,1,1
"430",642204,0,"09-08-2012","We love Asheville and enjoy exploring other destinations around the world.","within a few hours","100%","83%","f",22,22,"['email', 'phone', 'google', 'reviews']","$ 335.00",2012-08-09,1660,1,1,1,1
"431",7997863,111,"07-11-2013","Fun-loving, laid-back married couple always up for something new or interesting. Hiking, running, dancing, yoga, board/card games, movies, crafting, cooking, breweries, going out to chill in AVL, or getting all dolled up for downtown - we love to have a good time. We spent 3 years in California hosting on AirBnB and absolutely loved the experience. We are looking forward to hosting more guests in our new home in Asheville. We are getting to know the land, the people, the food, the culture, and we love to share our recommendations with guests. We are pretty easy going hosts and love meeting new people. I guess that means we are pretty easy guests too! Looking to rent out our guest suite and stay with other hosts to make new friends around the world.","within a few hours","90%","64%","t",1,1,"['email', 'phone', 'reviews', 'kba']","$ 89.00",2013-11-07,1205,1,1,1,1
"432",7998973,111,"12-11-2014","","within an hour","100%","100%","f",1,1,"['email', 'phone', 'reviews', 'kba']","$ 175.00",2014-11-12,835,1,1,1,1
"433",660702,0,"21-08-2012","I followed the whitewater to this beautiful mecca in the mountains.  I love all the amazing opportunities to be in the gorgeous natural beauty of this area.  So many rivers, waterfalls, trails, and views to enjoy.  Asheville also happens to be one of the coolest towns I've ever come across to hang out in.  Southern charm, for sure.  Lots of great live music, delicious restaurants, local festivals, amazing art scene, and a happening dance community.  Oh yeah, a healing arts mecca.  Plenty of yoga and therapeutic options around these parts.
I'll tell you where to find the best huevo rancheros you've ever had in your life!
I've lived in Asheville for 10 years now, and know the area pretty well from all of my exploration.  I have worked at the 5 star resort, The Grove Park Inn, and happen to live just one mile from this world famous Resort and Spa.  Being a massage therapist there, I can tell you which treatments will be perfect for you.  I have spent plenty of time at the Biltmore Estates and can suggest good walks to take there.","within a few hours","100%","100%","f",2,2,"['email', 'phone', 'facebook', 'reviews', 'kba']","$ 100.00",2012-08-21,1648,1,1,1,1
"434",3852773,0,"21-08-2012","I followed the whitewater to this beautiful mecca in the mountains.  I love all the amazing opportunities to be in the gorgeous natural beauty of this area.  So many rivers, waterfalls, trails, and views to enjoy.  Asheville also happens to be one of the coolest towns I've ever come across to hang out in.  Southern charm, for sure.  Lots of great live music, delicious restaurants, local festivals, amazing art scene, and a happening dance community.  Oh yeah, a healing arts mecca.  Plenty of yoga and therapeutic options around these parts.
I'll tell you where to find the best huevo rancheros you've ever had in your life!
I've lived in Asheville for 10 years now, and know the area pretty well from all of my exploration.  I have worked at the 5 star resort, The Grove Park Inn, and happen to live just one mile from this world famous Resort and Spa.  Being a massage therapist there, I can tell you which treatments will be perfect for you.  I have spent plenty of time at the Biltmore Estates and can suggest good walks to take there.","within a few hours","100%","100%","f",2,2,"['email', 'phone', 'facebook', 'reviews', 'kba']","$ 40.00",2012-08-21,1648,1,1,1,1
"435",11201757,0,"20-10-2014","I'm a 41 year old male with a 5 year old daughter. I've lived in Asheville 10+ years and enjoy visitors to the city I call home.","within a day","76%","59%","f",2,2,"['email', 'phone', 'reviews']","$ 60.00",2014-10-20,858,1,1,1,1
"436",11202166,0,"20-10-2014","I'm a 41 year old male with a 5 year old daughter. I've lived in Asheville 10+ years and enjoy visitors to the city I call home.","within a day","76%","59%","f",2,2,"['email', 'phone', 'reviews']","$ 120.00",2014-10-20,858,1,1,1,1
"437",12266568,0,"10-12-2014","We  have lived in Asheville for the last 25 years and can not imagine living anywhere else.  This home is where we have resided for the last 20 years until a year ago when we moved a block away.  Hope you will now enjoy it as much as we have!","within an hour","100%","0%","f",1,1,"['email', 'phone']","$ 595.00",2014-12-10,807,1,1,1,1
"438",3888565,0,"16-08-2014","Easy-going and considerate, I have  two children in college and teach Buddhism and Yoga worldviews at the University of North Carolina, Asheville Osher Lifelong Learning Institute. I grew up in the south, lived in Japan as a Zen monk, have traveled extensively in Europe and Asia, attended grad school at Stanford and managed a business at Palo Alto, CA. I've lived at Asheville for 14 years, know the city and region well and enjoy assisting guests in planning their dining, sightseeing and recreation. Hosting guests runs deep in my family, as my grandparents opened their large house as a bed and breakfast for many years.","within an hour","100%","96%","t",2,2,"['email', 'phone', 'reviews']","$ 75.00",2014-08-16,923,1,1,1,1
"439",7035619,0,"09-08-2012","We love Asheville and enjoy exploring other destinations around the world.","within a few hours","100%","83%","f",22,22,"['email', 'phone', 'google', 'reviews']","$ 105.00",2012-08-09,1660,1,1,1,1
"440",2072026,0,"30-08-2013","Graphic designer, married to Tom. 
We have 2 cats, one is 21 and one is about a year. 
We enjoy mountain biking, road biking, climbing, hiking, and food and wine. And coffee and chocolate. 
And LOVE our home in Asheville, a great place to live or visit!","within an hour","100%","100%","f",2,2,"['email', 'phone', 'facebook', 'google', 'linkedin', 'reviews', 'kba']","$ 110.00",2013-08-30,1274,1,1,1,1
"441",1813448,111,"18-08-2010","I am a project manager at a small interactive tv company and also an artist. I have cats named Remus and Penny.
I love to travel and have been throughout southeast asia, Australia, some of Europe and north africa, all over the US, and lived in Japan for a year. I'm a big baseball fan, we have a great minor league team in Asheville! I'm pretty liberal and a vegetarian, but I don't care if you cook meat in my frying pan.","within a day","100%","100%","t",1,1,"['email', 'phone', 'reviews', 'kba']","$ 90.00",2010-08-18,2382,1,1,1,1
"442",9243493,111,"03-11-2015","I traveled all over the world and now have put down roots in North Carolina.  My stone and cedar cabin looks much like an Italian Alpine cottage, so impressions of Northern Italy found their way into the landscaping.  Most of all, the house  is what it always want to be â a faithfully restored cabin with all the modern luxuries.  It's a peaceful mountain retreat minutes from the excitement of downtown Asheville, and also near the Blue Ridge Parkway with spectacular hiking, biking, and scenic driving. I love making Red Gate Cottage a special home away from home for my guests.  I live just a few minutes away and I'm service oriented, so I enjoy making sure my guests lack for nothing.","within a few hours","100%","0%","f",1,1,"['email', 'phone', 'reviews']","$ 295.00",2015-11-03,479,1,1,1,1
"443",6056098,111,"17-04-2015","My partner and I enjoy the wonderful life that Asheville has to offer:  its diversity, culture and eclectic spirit.  We love our home and its wonderful location:  cool summer breezes, abundant flowering gardens, ease of access to Downtown Asheville.  We hope you'll love our home and gardens just as much, and we want your stay to be comfortable, safe and relaxing.

We look forward to your stay with us!","within an hour","75%","100%","t",1,1,"['email', 'phone', 'facebook', 'reviews', 'kba']","$ 125.00",2015-04-17,679,1,1,1,1
"444",11802559,0,"16-10-2012","Cosmic mermaid with a bit of an eclectic and eccentric sense of life.  Adventuresome spirit who enjoys connecting with others and would love to host as many travelers as possible! Loves stories from both near and far, as well as expanding her network on the global grid.  Thanks for your interest, she is already looking forward to your stay :)","within an hour","100%","100%","f",5,5,"['email', 'phone', 'facebook', 'google', 'linkedin', 'reviews', 'jumio']","$ 45.00",2012-10-16,1592,1,1,1,1
"445",1843828,0,"24-10-2013","My husband and I are originally from Michigan. We came to Asheville after living on our sail boat in the Caribbean for a few years. Dick still sails, RC sailboats, on the local lake and I am a painter and jewelry artist. Living in Asheville feeds my creative soul. Although, living in  Asheville is a long way from the sea and family we would never live anywhere else. Even after 24 years living here is still new, fresh and exciting to us. We spend time exploring new restaurants, galleries and shops and making new friends and enjoying the old. Our motto is ""Don't postpone joy.""","within a few hours","100%","83%","t",1,1,"['email', 'phone', 'reviews']","$ 250.00",2013-10-24,1219,1,1,1,1
"446",1475299,0,"04-01-2012","I like putting people and environments together and have converted my art studio to a rental cottage to do just that.  Since graduating from Carnegie Mellon as a painter, A LONG TIME AGO, I have had many creative occupations including theater, film, interior design and teaching. A strong desire to share the property that my husband and I have sculpted together for 15 years has led to the conversion of a free standing art studio to RACK FOCUS COTTAGE  (304379). The need for a 3 BR led to the renovation of RACK FOCUS (PHONE NUMBER HIDDEN)) . Because this property is right across the street from the cottage, its guests can easily share the wooded walk, creek sitting,meadow and fire pit of the park-like setting of the cottage. Similarly furnished and appointed it is ideal for larger groups. We love to travel but this is our favorite destination. Make Asheville yours. Stay with us.  Short, extended stay or long term.","within a few hours","100%","100%","f",2,2,"['email', 'phone', 'facebook', 'linkedin', 'reviews', 'kba']","$ 265.00",2012-01-04,1878,1,1,1,1
"447",3961524,0,"16-08-2014","Easy-going and considerate, I have  two children in college and teach Buddhism and Yoga worldviews at the University of North Carolina, Asheville Osher Lifelong Learning Institute. I grew up in the south, lived in Japan as a Zen monk, have traveled extensively in Europe and Asia, attended grad school at Stanford and managed a business at Palo Alto, CA. I've lived at Asheville for 14 years, know the city and region well and enjoy assisting guests in planning their dining, sightseeing and recreation. Hosting guests runs deep in my family, as my grandparents opened their large house as a bed and breakfast for many years.","within an hour","100%","96%","t",2,2,"['email', 'phone', 'reviews']","$ 95.00",2014-08-16,923,1,1,1,1
"448",3968877,0,"23-01-2014","","within an hour","100%","100%","t",1,1,"['email', 'phone', 'facebook', 'google', 'linkedin', 'reviews', 'kba']","$ 125.00",2014-01-23,1128,1,1,1,1
"449",12411808,0,"05-04-2016","","N/A","N/A","N/A","f",1,1,"['email', 'phone', 'google', 'linkedin', 'kba']","$ 75.00",2016-04-05,325,1,1,1,1
"450",2987695,0,"07-05-2014","Joshua, Luna, and their daughter Jaya have been traveling the world and living in different places the past 10 years. A big part of their journey has been visiting and living in other people's homes. When purchasing this home in 2013 they were excited at the opportunity to open this space to new guests to share in the experience of being hosts. It is our pleasure to open our home to you and hope you come visit our beautiful Asheville Mountain Getaway.","within a few hours","100%","95%","t",1,1,"['email', 'phone', 'reviews', 'kba']","$ 95.00",2014-05-07,1024,1,1,1,1
"451",6791922,112,"22-12-2012","We are West Coast transplants, living in beautiful Asheville, NC.  We own a wholesale candle company, and absolutely love good food, craft beer, bluegrass music, hiking with our pups, and getting out to discover fun new adventures.","within an hour","100%","100%","t",2,2,"['email', 'phone', 'facebook', 'reviews', 'kba']","$ 94.00",2012-12-22,1525,1,1,1,1
"452",1956037,0,"18-11-2013","Atlanta-based professional looking to rent vacation home.","within an hour","100%","100%","f",1,1,"['email', 'phone', 'facebook', 'reviews', 'kba']","$ 140.00",2013-11-18,1194,1,1,1,1
"453",4173713,0,"05-09-2014","","within a few hours","100%","100%","t",2,2,"['email', 'phone', 'facebook', 'reviews', 'jumio']","$ 240.00",2014-09-05,903,1,1,1,1
"454",7262543,0,"09-08-2012","We love Asheville and enjoy exploring other destinations around the world.","within a few hours","100%","83%","f",22,22,"['email', 'phone', 'google', 'reviews']","$ 85.00",2012-08-09,1660,1,1,1,1
"455",3084395,0,"18-05-2014","","within an hour","100%","86%","t",3,3,"['email', 'phone', 'google', 'reviews', 'jumio']","$ 150.00",2014-05-18,1013,1,1,1,1
"456",5193198,0,"28-01-2015","","within an hour","80%","95%","t",1,1,"['email', 'phone', 'reviews']","$ 55.00",2015-01-28,758,1,1,1,1
"457",12010137,0,"16-10-2012","Cosmic mermaid with a bit of an eclectic and eccentric sense of life.  Adventuresome spirit who enjoys connecting with others and would love to host as many travelers as possible! Loves stories from both near and far, as well as expanding her network on the global grid.  Thanks for your interest, she is already looking forward to your stay :)","within an hour","100%","100%","f",5,5,"['email', 'phone', 'facebook', 'google', 'linkedin', 'reviews', 'jumio']","$ 85.00",2012-10-16,1592,1,1,1,1
"458",8209965,0,"30-08-2015","I am a personal assistant for a community and health based organization known as ""The Spot"", located in downtown Asheville. This group of people I am working with are tight knit and trustworthy and I am here to help them, as they are helping me with my personal goals. I wish to further my self and community taught education in Women's/Human studies and Holistic Health. I am physically active and enjoy exercise and participating in competitive sports. I enjoy a city life but also a rural one which is why Asheville has been a perfect place for myself. 
 I require respect and care from the people looking to share my space. If you have any other questions for me and this space call my number or email provided.","within a few hours","82%","97%","f",3,3,"['email', 'phone', 'google', 'reviews']","$ 45.00",2015-08-30,544,1,1,1,1
"459",1011345,0,"09-08-2012","We love Asheville and enjoy exploring other destinations around the world.","within a few hours","100%","83%","f",22,22,"['email', 'phone', 'google', 'reviews']","$ 145.00",2012-08-09,1660,1,1,1,1
"460",1020827,0,"09-08-2012","We love Asheville and enjoy exploring other destinations around the world.","within a few hours","100%","83%","f",22,22,"['email', 'phone', 'google', 'reviews']","$ 130.00",2012-08-09,1660,1,1,1,1
"461",12041570,0,"31-12-2014","I am newly retired after many years of diverse professions.  I am now enjoying tennis, hiking, classes at UNCA, book club, yoga, entertaining (love to cook and bake), volunteering for the literacy council. I love to travel and have been fortunate to have been to many places around the world, most recently Thailand. I have many wonderful friends and enjoy meeting new ones.  And yes, I have a 4 year old grandson named Connor who I adore.
Words to live by: ""Those who don't believe in magic will never find it.""","within a day","100%","100%","f",1,1,"['email', 'phone', 'facebook', 'google', 'reviews', 'kba']","$ 115.00",2014-12-31,786,1,1,1,1
"462",6275127,0,"04-05-2015","I like to mix and mingle with all types and ages of people and sharing stories of life in general.  My home is my retreat and now I want to share it with others.  I've lived many places in the US, love to travel and like music of all kinds, especially funk, salsa and jazz.  I love introducing people to Asheville and know it well.  I moved here from San Francisco and know you will enjoy your time here too.  I'm open to sharing a glass of wine or tea on my deck after you've enjoyed your day if you'd like - and will respect your privacy too, as you do mine.  Let the magic happen!","within an hour","100%","100%","f",1,1,"['email', 'phone', 'google', 'linkedin', 'reviews', 'kba']","$ 100.00",2015-05-04,662,1,1,1,1
